Musée du Prieuré;7634101;Mairie d'Harfleur 50, Rue de la République  B.P. 97;76700;HARFLEUR;02 35 45 40 62;02 35 13 30 19;;;Ouvert de juin à septembre du mercredi, samedi, dimanche de 15h à 18h, en juillet-août du mercredi au dimanche et d'octobre à ma, les mercredis, samedis et dimanches de 15h à 18h;;01/02/2003;;NORMANDIE;SEINE-MARITIME;49.4973035255,0.236903290282
Musée Joseph Abeilhé;3223301;Mairie de Marciac 19, Place de l'Hôtel de Ville;32230;MARCIAC;05 62 09 38 03;05 62 08 23 10;;;Ouvert du lundi au vendredi de 8h30 à 12h et de 13h30 à 17h;;01/02/2003;;OCCITANIE;GERS;43.5313710176,0.169580700883
Musée du Pays Rabastinois;8122001;Hôtel de La Fite 2, Rue Amédée Clausade;81800;RABASTENS;05 63 40 65 65;05 63 33 64 05;;Décembre;Ouvert du mardi au vendredi de 10h à 12h et de 14h à 18h, samedi, dimanche et jours fériés de 14h à 18h;Nuit des musées;01/02/2003;;OCCITANIE;TARN;43.8337179111,1.69697473698
Musée Ornithologique (Ecomusée de la Brenne);3601801;Château Naillac;36300;LE BLANC;02 54 37 25 20;02 54 28 69 49;;Janvier, 11 novembre et 25 décembre;Ouvert du 26 mars au 30 juin et septembre du mardi au dimanche de 14h à 18h, juillet-août tous les jours de 10h à 12h30 et de 14h à 18h, du 1er octobre au 31 décembre du mardi au dimanche de 14h à 17h30;;01/02/2003;;CENTRE-VAL DE LOIRE;INDRE;46.629212,1.061409
Musée Lansyer;3713201;1, rue Lansyer;37600;LOCHES;02 47 59 48 21;02 47 59 05 45;;1er novembre au 31 mars;Ouvert du 4 juin au 2 novembre, de juin à août tous les jours, de septembre à novembre du mercredi au dimanche de 10h à 18h30;;01/02/2003;;CENTRE-VAL DE LOIRE;INDRE ET LOIRE;47.126829,0.997457
Musée Daniel Vannier;4502801;Hôtel de Ville - Service patrimoine 20, Rue du Change;45190;BEAUGENCY;02 38 44 62 64;02 38 46 40 37;;;;;01/02/2003;;CENTRE-VAL DE LOIRE;LOIRET;47.8004436022,1.60034648518
Musée George Sand et de la Vallée Noire;3604601;71, Rue Venôse;36400;LA CHATRE;02 54 48 36 79;02 54 48 36 79;;Janvier, 1er mai, 25 et 26 décembre;Ouvert du mercredi au lundi en février, mars, novembre, décembre de 14h à 17h, avril, octobre de 14h30 à 18h30, mai, juin, septembre de 10h à 12h et de 14h à 18h30, le dimanche de 14h à 18h30, et en juillet-août tous les jours de 10h à 12h et de 14h à 18h;;01/02/2003;;CENTRE-VAL DE LOIRE;INDRE;46.581939,1.989964
Musée des Tisserands Mayennais;5300301;Place Billard de Veaux;53300;AMBRIERES-LES-VALLEES;02 43 04 96 19;02 43 08 97 38;;;Ouvert en juillet août de 14h30 à 18h30 du mardi au dimanche. Ouvert pour les groupes sur rendez-vous toute l'année;;01/02/2003;;PAYS DE LA LOIRE;MAYENNE;48.403045,-0.630604
Musée au Fil du Papier;5443101;Hôtel de la Monnaie 13, Rue Magot de Rogéville;54700;PONT-A-MOUSSON;03 83 87 80 14;03 83 87 80 18;;1er janvier, dimanche de Pâques, 1er mai, 14 juillet, 1er novembre,  25 décembre;Ouvert du 2 mai au 30 septembre lundi, mercredi au samedi de 14h à 18h, dimanche de 10h à 12h et de 14h à 18h, du 1er octobre au 30 avril lundi, mercredi au lundi de 14h à 17h;;01/02/2003;;GRAND EST;MEURTHE ET MOSELLE;48.908234208,6.05844193294
Musée d'Archéologie Méditerranéenne;1305507;Centre de la Charité 2, rue de la Charité;13002;MARSEILLE;04 91 14 58 80;04 91 14 58 76;;1er janvier, 1er mai, 1er novembre, 25 décembre;Ouvert du mardi au dimanche  de 10h à 18h;;01/02/2003;;PROVENCE-ALPES-CÔTE D'AZUR;BOUCHES DU RHONE;43.3127325556,5.36355601234
Musée de la Tour Abbatiale;5952601;Tour Abbatiale Grand'Place;59230;SAINT-AMAND-LES-EAUX;03 27 22 26 93;03 27 22 26 90;;1er janvier, 1er novembre, 25 décembre;Ouvert lundi, mercredi, jeudi et vendredi de 14h à 17h, samedi, dimanche et jours fériés de 10h30 à 12h et de 14h à 18h;;01/02/2003;;HAUTS-DE-France;NORD;50.4489515034,3.43065651887
Musée du Biterrois;3403202;Rampe du 96ème caserne Saint Jacques;34500;BEZIERS;04 67 36 81 61;04 67 36 81 69;;1er janvier, dimanche de Pâques, 1er mai et 25 décembre;Ouvert du 1er octobre au 31 mai du mardi au vendredi de 10h à 17h, samedi et dimanche de 10h à 18h et du 1er juin au 30 septembre du mardi au dimanche de 10h à 18h;;01/02/2003;;OCCITANIE;HERAULT;43.3428885301,3.23996566024
Musée d'Histoire de la Ville de Saint-Malo;3528802;Château Esplanade Félicité Lamennais - B.P. 147;35401;SAINT-MALO;02 99 40 71 85;02 99 40 71 56;;1er janvier, 1er mai, 1er et 11 novembre, 25 décembre;Ouvert d'avril à septembre tous les jours de 10h à 12h30 et de 14h à 18h et d'octobre à mars de 10h à 12h et de 14h à 18h du mardi au dimanche;;01/02/2003;;BRETAGNE;ILE ET VILAINE;
Musée Goupil;3306310;Conservatoire de l'Image Industrielle 20 Cours Pasteur;33000;BORDEAUX;05 56 01 69 40;05 56 01 69 41;;Musée Aquitaine;Musée Aquitaine - Le musée Goupil fonctionne uniquement sur exposition temporaire, à raison d’une par an, en général à l’automne.;;01/02/2003;;NOUVELLE-AQUITAINE;GIRONDE;44.8579384389,-0.573595011059
Musée-Château de Cagnes;602701;7, Place Grimaldi Haut de Cagnes;6800;CAGNES-SUR-MER;04 92 02 47 30;02 92 02 47 39;;1er janvier, 25 décembre - une semaine au début de décembre;Ouvert d'octobre à mars du mercredi au lundi de 10h à 12h et de 14h à 17h, d'avril à juin et septembre de 10h à 12h et de 14h à 18h, en juillet-août de 10h à 13h et de 14h à 18h;;01/02/2003;;PROVENCE-ALPES-CÔTE D'AZUR;ALPES-MARITIMES;43.6717115004,7.15221251149
Musée des Travaux Publics;9202602;Mairie de Courbevoie;92400;COURBEVOIE;01 43 34 70 00;01 47 88 02 83;;;;;06/01/2002;;ÎLE-DE-France;HAUTS DE SEINE;48.901324,2.256239
Musée de l'Abbaye Saint-Michel;8109903;Place Saint-Michel;81600;GAILLAC;05 63 41 03 81;05 63 57 56 83;;1er janvier, 1er mai, 1er novembre et 25 décembre;Ouvert du 1er avril au 30 juin + septembre tous les jours de 10h à 12h et de 14h à 18h, et du 1er juillet au 31 août tous les jours de 10h à 12h et de 14h à 18h et du 1er octobre au 31 mars du mercredi au dimanche de 10h à 12h et de 14h à 17h;;01/02/2003;;OCCITANIE;TARN;43.897879,1.895779
Musée des Beaux-Arts;608305;3, Avenue de la Madone;6500;MENTON;04 93 35 49 71;04 92 41 80 66;;1er janvier, 1er mai, 11 novembre, 25 décembre;Ouvert du mercredi au lundi de 10h à 12h et de 14h à 18h;;01/02/2003;;PROVENCE-ALPES-CÔTE D'AZUR;ALPES-MARITIMES;43.766659,7.4884
Musée Villeneuvien;8946401;Porte de Joigny et 2, Rue Carnot;89500;VILLENEUVE-SUR-YONNE;03 86 87 37 66;03 86 72 85 00;;;Ouvert du mercredi au dimanche de 14h30 à 18h30 en juillet-août;;01/02/2003;;BOURGOGNE-FRANCHE-COMTE;YONNE;48.080297,3.294088
Musée Intercommunal d'Etampes;9122301;Place de l'Hôtel de Ville et des Droits de l'Homme;91150;ETAMPES;01 69 92 69 12;01 69 92 69 03;;1er janvier, 1er et 8 mai, 1er et 11 novembre, 25 décembre;Ouvert du mercredi au dimanche de 14h à 17h;;01/02/2003;;ÎLE-DE-France;ESSONNE;48.434307,2.161909
Musée Louis Français;8835101;30, Avenue Louis Français;88370;PLOMBIERES-LES-BAINS;03 29 66 00 24;03 29 66 06 00;;;Ouvert en 2013 en visite guidée accompagnée et lors de certaines grandes manifestations organisées par la ville;;01/02/2003;;GRAND EST;VOSGES;47.964095,6.458494
Hôtel Cabu, Musée d'Histoire et d'Archéologie;4523402;Square Abbé Desnoyers Hôtel Cabu;45000;ORLEANS;02 38 79 25 60;02 38 79 20 08;;1er et 11 novembre, 25 décembre;Salles gallo-romaine et Jeanne d'Arc : Du mardi au vendredi : 9h30-12h (groupes sur réservation) et 13h30 - 17h45 Toutes les salles : Samedi : 9h30 - 12h et 13h30 - 17h45 Dimanche : 14h - 18h;;01/02/2003;;CENTRE-VAL DE LOIRE;LOIRET;47.8826248233,1.91635582903
Musée Pincé;4900702;32 bis rue Lenepveu;49100;ANGERS;02 41 05 38 00;02 41 05 38 39;;;;;01/02/2003;;PAYS DE LA LOIRE;MAINE-ET-LOIRE;47.471767,-0.551841
Musée de la Vénerie;6061203;Place du Parvis Notre Dame;60300;SENLIS;03 44 29 49 93;03 44 53 11 99;;1er janvier, 1er mai, 25 décembre;Ouvert mardi de 14h à 18h, mercredi,  jeudi, vendredi de 10h à 12h et de 14h à 18h, samedi, dimanche et jours fériés de 11h à 13h et de 14h à 18h;;01/02/2003;;HAUTS-DE-France;OISE;49.207042,2.585316
Musée des Vins de Touraine;3726104;Cellier Saint-Julien 16, Rue Nationale;37000;TOURS;02 47 61 07 93;02 47 21 68 90;;;;;01/02/2003;;CENTRE-VAL DE LOIRE;INDRE ET LOIRE;47.3979724257,0.696297496341
Musée Vert Véron-de-Forbonnais;7218199;204, Avenue Jean-jaurès;72100;LE MANS;02 43 47 39 94;02 43 47 48 61;;;Ouvert du lundi au vendredi de 9h à 12h et de 14h à 18h, le dimanche de 14h à 18h;;01/02/2003;;PAYS DE LA LOIRE;SARTHE;47.986868,0.208417
Musée des Beaux-Arts;1106901;1, Rue de Verdun;11000;CARCASSONNE;04 68 77 73 70;04 68 77 73 89;;1er janvier, 1er et 8 mai, 1er et 11 novembre, 25 décembre;Ouvert du 15 juin au 15 septembre tous les jours de 10h à 18h et du 15 septembre au 15 juin du mardi au samedi de 10h à 12h et de 14 h à 18 h et le premier dimanche du mois de 14h30 à 17h30,;;01/02/2003;;OCCITANIE;AUDE;43.212595,2.35536
Musée Jean Lurcat et de la Tapisserie Contemporaine;4900703;4, Bd Arago;49100;ANGERS;02 41 24 18 45;02 41 05 38 39;;1er janvier, 1er mai, 1er et 11 novembre et 25 décembre;Ouvert du 2 janvier au 30 avril et du 22 septembre au 31 décembre : du mardi au dimanche de 10h à 12h et de 14h à 18h Du 2 mai au 20 septembre 2015 : tous les jours et de 10h à 18h;Nocturnes événementielles;01/02/2003;;PAYS DE LA LOIRE;MAINE-ET-LOIRE;47.477759,-0.557052
Musée de la Castre;602901;Le Suquet;6400;CANNES;04 93 38 55 26;04 93 38 81 50;;1er janvier, 1er mai, 1er et 11 novembre, 25 décembre;Ouvert d'octobre à mars de 10h à 13h et de 14h à 17h, d'avril à juin et septembre de 10h à 13h et de 14h à 18h, juillet-août tous les jours de 10h à 19h;Mercredi jusqu'à 21h de juin à septembre;01/02/2003;;PROVENCE-ALPES-CÔTE D'AZUR;ALPES-MARITIMES;43.551506,7.010014
Musée d'Archéologie;3930001;7, Rue des Cordeliers;39000;LONS-LE-SAUNIER;03 84 47 88 45;03 84 47 85 45;;;Pas de salle d'expositions actuellement, mais maintien de conférences et animations toute l'année;;01/02/2003;;BOURGOGNE-FRANCHE-COMTE;JURA;46.674422,5.555197
Musée Benoît de Puydt;5904301;24, Rue du Musée de Puydt;59270;BAILLEUL;03 28 49 12 70;03 28 44 31 04;;1er et 8 mai, 14 juillet, 1er novembre, les 4 jours de carnaval, du 24 décembre au 1er janvier;Ouvert de 14h à 17h30 du mercredi au dimanche. Ouverture exceptionnelle lundi de Pâques, jeudi de l'Ascension, lundi de Pentecôte, 15 août, 11 novembre;;01/02/2003;;HAUTS-DE-France;NORD;50.740715,2.734399
Musée du Chablais;7428102;Château de Sonnaz 2, Rue Michaud;74200;THONON-LES-BAINS;04 50 70 69 49;04 50 70 69 54;;Jours fériés;Ouvert du 25 mars au 30  juin de 14h30 à 18h, en juillet août tous les jours de 10h à 12h et de 15h à 18h30, de septembre au 13 novembre tous le sjours de 14h30 à 18h;;01/02/2003;;AUVERGNE-RHÔNE-ALPES;HAUTE-SAVOIE;46.3412678337,6.50524347796
Musée d'Art de Toulon;8313703;113, Boulevard du Maréchal Leclerc;83000;TOULON;04 94 36 81 01;04 94 36 82 21;;;Ouvert du mardi au dimanche de 12h à 18h;;01/02/2003;;PROVENCE-ALPES-CÔTE D'AZUR;VAR;43.125971,5.927245
Musée Sobirats;8403105;112, Rue du Collège;84200;CARPENTRAS;04 90 63 04 92;04 90 63 19 11;;Du 1er octobre au 30 mars et jours fériés;Ouvert du 1er avril au 30 septembre du mercredi au lundi de 10h à 12h et de 14h à 18h;;01/02/2003;;PROVENCE-ALPES-CÔTE D'AZUR;VAUCLUSE;44.054477,5.046269
Musée Municipal d'Hazebrouck;5929501;Ancien Couvent des Augustins Place Georges Degroote;59190;HAZEBROUCK;03 28 43 44 46;03 28 40 78 66;;Jours fériés;Ouvert du mardi au dimanche de 14h à 17h30;;01/02/2003;;HAUTS-DE-France;NORD;50.716080125,2.53498842642
Musée d'Art et d'Histoire;7849802;12, Rue Saint-Louis;78300;POISSY;01 39 65 06 06;01 39 65 03 14;;;;;01/02/2003;;ÎLE-DE-France;YVELINES;48.930803,2.038693
Musée Régional d'Ethnologie;6211901;211, avenue Kennedy;62400;BETHUNE;03 21 68 40 74;03 21 65 34 35;;Jours fériés;Musée en restructuration. Ouvert du mercredi au dimanche de 14h30 à 18h (exposition);;01/02/2003;;HAUTS-DE-France;PAS-DE-CALAIS;50.536456,2.648235
Musée Henri Chapu;7728501;937, Rue Chapu;77350;LE MEE-SUR-SEINE;01 64 39 52 73;01 64 87 55 55;;Août;Ouvert les samedis et dimanches de 15h à 18h l'été et de 14h à 17h l'hiver et sur rendez-vouspour les groupes;;01/02/2003;;ÎLE-DE-France;SEINE ET MARNE;48.534859,2.635235
Musée du Jouet Pierre Pinel;7849801;1, Enclos de l'Abbaye;78300;POISSY;01 39 65 06 06;01 39 65 03 14;;Jours fériés;Ouvert du mardi au dimanche de 9h30 à 12h et de 14h à 17h30;;01/02/2003;;ÎLE-DE-France;YVELINES;48.928536,2.03784
Muséum d'Histoire Naturelle;3403203;15 Place Pierre Semard;34500;BEZIERS;04 67 36 81 61;04 67 36 81 69;;1er janvier, dimanche de Pâques, 1er mai et 25 décembre;Ouvert du  1 er avril au 30 juin de 9h à 12h et de 14h à 18h,  du 1 er juillet au 31 août de 10h à 18h,  duer septembre au 31 octobre de 9h à 12h et de 14h à 18h,  duer novembre au 31 mars de 9h à 12h et de 14h 17h;;01/02/2003;;OCCITANIE;HERAULT;43.343271,3.211298
Musée de la Mer;602902;Fort Royal de l'Ile-Sainte-Marguerite;6400;CANNES;04 93 38 55 26;04 93 38 81 50;;1er janvier, 1er mai, 1er et 11 novembre, 25 décembre;Ouvert d'octobre à mars de 10h30 à 13h15 et de 14h15 à 16h45, d'avril à mai de 10h30 à 13h15 et de 14h15 à 17h45, de juin à septembre tous les jours de 10h à 17h45;;01/02/2003;;PROVENCE-ALPES-CÔTE D'AZUR;ALPES-MARITIMES;43.5526938306,7.00247889833
Musée Bernadotte;6444502;8, Rue Tran;64000;PAU;05 59 27 48 42;05 58 98 09 63;;;Ouvert du mardi au dimanche de 10h à 12h et de  14h à 18h;;01/02/2003;;NOUVELLE-AQUITAINE;PYRÉNÉES ATLANTIQUES;43.297209,-0.372526
Musée Comtadin-Duplessis;8403103;Bibliothèque-musée Inguimbertine 234, Boulevard Albin-Durand;84200;CARPENTRAS;04 90 63 04 92;04 90 63 19 11;;1er octobre au 30 mars + jours fériés;Ouvert du 1er avril au 30 septembre du mercredi au lundi de 10h à 12h et de 14h à 18h;Nuit des musées;01/02/2003;;PROVENCE-ALPES-CÔTE D'AZUR;VAUCLUSE;44.059163985,5.06111954826
Musée Municipal;8519101;Rue Jean Jaurès;85000;LA ROCHE-SUR-YON;02 51 47 48 35;02 51 47 45 99;;;Ouvert du mardi au samedi de 13h à 18h. Visites commentées et accueil des groupes du mardi au vendredi de 9h à 12 h et de 13 h à 17 h (sur Rendez-vous);;01/02/2003;;PAYS DE LA LOIRE;VENDEE;46.669421,-1.428889
Musée des Beaux-Arts de Saint-Denis;5145401;8, Rue Chanzy;51100;REIMS;03 26 35 36 00;03 26 86 87 75;;1er janvier, 1er mai, 14 juillet, 1er et 11 novembre, 25 décembre;Ouvert du mercredi au lundi de 10h à 12h et de 14h à 18h, du 14 décembre 2012 au 26 mai 2013 le jeudi de 10h à 20h;;06/01/2002;;GRAND EST;MARNE;49.25323,4.031072
Musée d'Ethnographie et d'Arts Populaires et Musée de la Marine;1433301;Musée du Vieux Honfleur B.P. 60082;14603;HONFLEUR;02 31 89 14 12;02 31 89 14 12;;28 novembre au 10 février, 1er mai, 14 juillet;Ouvert du 11 février au 31 mars et du 1er octobre au 26 novembre du mardi au vendredi de 14h30 à 17h30, samedi, dimanche de 10h à 12h et de 14h30 à 17h30, du 1er avril au 30 septembre du mardi au dimanche de 10h à 12h et de 14h à 18h30;;01/02/2003;;NORMANDIE;CALVADOS;
Musée Gatien Bonnet;7724301;8, Cour Pierre Herbin;77405;LAGNY-SUR-MARNE;01 64 30 30 78;01 64 12 47 55;;Jours fériés;Ouvert du mercredi au dimanche de 14h à 18h;;01/02/2003;;ÎLE-DE-France;SEINE ET MARNE;
Musée de Préhistoire Régionale;608303;Rue Lorédan Larchey;6500;MENTON;04 93 35 84 64;04 92 10 05 40;;1er janvier, 1er mai, 1er novembre et 25 décembre;Ouvert du mercredi au lundi de 10h à 12h et de 14h à 18h;;01/02/2003;;PROVENCE-ALPES-CÔTE D'AZUR;ALPES-MARITIMES;43.77648,7.503609
Hôtel Hèbre de Saint-Clément - Musée d'Art et d'Histoire;1729903;63-65 avenue de Gaulle;17300;ROCHEFORT;05 46 82 91 60;05 46 82 91 76;;Janvier, 1er mai, 25 décembre;Ouvert du 1er février au 14 juin et du 1er octobre au 31 décembre du mardi au vendredi de 10h30 à 12h30 et de 14h à 18h et le week-end de 14h à 18h. Du 15 juin au 30 septembre  du mardi au vendredi de 10h30 à 12h30 et de 14h à 19h et le week-end de 14h à;;28/03/2002;;NOUVELLE-AQUITAINE;CHARENTE-MARITIME;45.935533,-0.96181
Maison des Ailleurs - Arthur Rimbaud;810502;Quai Rimbaud;8000;CHARLEVILLE-MEZIERES;03 24 32 44 70;;;;Ouvert du mardi au dimanche de 10h à 12h et de 14h à 18h tous les jours;;01/02/2003;;GRAND EST;ARDENNES;49.776058,4.720484
Musée Boucher-de-Perthes;8000101;24, Rue Gontier-Patin;80100;ABBEVILLE;03 22 24 08 49;03 22 20 35 03;;1er janvier, 1er mai, 14 juillet, 1er novembre et 25 décembre;Ouvert du mercredi au lundi de 14h à 18h. Pour les groupes, autres horaires possibles sur rendez-vous du lundi au vendredi matin;;01/02/2003;;HAUTS-DE-France;SOMME;50.10712,1.833193
Musée de la Mémoire et des Industries Tullistes;1927202;1, Rue du 9 juin 1944;19000;TULLE;05 55 26 22 15;05 55 20 28 82;;1er janvier, 1er mai, jeudi de l'Ascension, 1er novembre, 25 décembre;Ouvert du 1er mai au 31 octobre de 10h à 13h et de 14h à 18h30, du 1er novembre au 30 avril de 13h à 18h le lundi et de mercredi et jeudi;;23/06/2008;;NOUVELLE-AQUITAINE;CORREZE;45.260416,1.751546
Musée des Docks Romains;1305504;2, Place Vivaux;13002;MARSEILLE;04 91 55 36 00;04 91 14 58 76;;1er janvier, 1er mai, 1er novembre et 25 et 26 décembre;Ouvert du mardi au dimanche de 10h à 18h;;01/02/2003;;PROVENCE-ALPES-CÔTE D'AZUR;BOUCHES DU RHONE;43.29647,5.367908
Musée Municipal (Moulin de Gajac);4732301;2, Rue du Jardins;47300;VILLENEUVE-SUR-LOT;05 53 40 48 00;05 53 01 57 64;;1er mai, 14 juillet, 1er et 11 novembre;Ouvert du mardi au vendredi de 10h à 12h et de 14h à 17h, samedi et dimanche de 14h à 17h et d'avril à octobre du mardi au vendredi de 10h à 12h et de 14h à 18h, samedi et dimanche de 14h à 18h;;01/02/2003;;NOUVELLE-AQUITAINE;LOT ET GARONNE;44.405095,0.707815
Musée de Vulliod Saint-Germain;3419901;3, Rue Albert-Paul Allies;34120;PEZENAS;04 67 98 90 59;04 67 90 41 11;;Janvier et décembre, mardi gras.;Ouvert de juin à septembre de 10h à 12h et de 14h à 19h, nocturne du 1er juillet au 15 septembre les mercredis et vendredis de 21h à 23h,  du 15 février au 31 mai et du 1er octobre au 15 novembre de 10h à 12h et de 14h à 17h30;Mercredi et vendredi de 21h à 23h du 1er juillet au 15 septembre;01/02/2003;;OCCITANIE;HERAULT;43.461352,3.422892
Musée des Arts Décoratifs et du Design;3306306;Hôtel de Lalande 39, Rue Bouffard;33000;BORDEAUX;05 56 10 14 00;05 56 10 10 01;;Jours fériés;Ouvert du mercredi au lundi de 14h à 18h, y compris les 14 juillet et 15 août. Expositions ouvertes de 11h à 18h en semaine et le week-end de 14h à 18h;;01/02/2003;;NOUVELLE-AQUITAINE;GIRONDE;44.8579384389,-0.573595011059
Abbaye de Graville - Musée du Prieuré de Graville;7635102;Rue de l'Abbaye;76600;LE HAVRE;02 35 19 09 85;02 35 19 69 70;;1er janvier, 1er mai, 8 mai, 14 juillet, 11 novembre et 25 décembre;Ouvert du 1er avril au 31 octobre du mercredi au  lundi de 10h à 12h30 et de 13h45 à 18h et du 1er novembre au 31 mars de 10h30 à 12h30 et e 13h45 à 17h30;;01/02/2003;;NORMANDIE;SEINE-MARITIME;49.503118,0.168438
Musée Barrois;5502901;Esplanade du Château;55000;BAR-LE-DUC;03 29 76 14 67;03 29 77 16 38;;1er janvier, 1er mai, 14 juillet, 15 août, 1er novembre, 25 décembre;Ouvert du mercredi au dimanche de  14h à 18h, et tous les jours en juillet août;;01/02/2003;;GRAND EST;MEUSE;48.771797,5.156074
Musée de la Faïence;1320801;Château Pastré  157, Avenue de Montredon;13008;MARSEILLE;04 91 72 43 47;04 91 72 53 58;;Jours fériés;Ouvert du 1er octobre au 31 mai du mardi au dimanche de 10h à 17h et du 1er juin au 30 septembre du mardi au dimanche de 11h à 18h;;01/02/2003;;PROVENCE-ALPES-CÔTE D'AZUR;BOUCHES DU RHONE;43.2388428582,5.37571442554
Musée du docteur Faure;7300801;Villa Les Chimères 10, Boulevard des Côtes;73100;AIX-LES-BAINS;04 79 61 06 57;04 79 35 22 70;;Du 20 décembre au 5 janvier et les jours fériés;Ouvert du mercredi au lundi de 10h à 12h et de 13h30 à 18h;;01/02/2003;;AUVERGNE-RHÔNE-ALPES;SAVOIE;45.7110465411,5.94212260662
Musée du Vieil Argenteuil;9501801;5, rue Pierre-Guienne;95100;ARGENTEUIL;01 34 23 37 45;01 34 23 37 49;;Août;Ouvert mercredi et premier dimanche du mois de 14h à 17h30 (hors expos), mercredi et dimanche de 14h à 17h30 pendant la période d'exposition, tous les jours sur réservation pour les groupes;;01/02/2003;;ÎLE-DE-France;VAL D'OISE;48.94388,2.256737
Musée de la vallée;401901;Villa La Sapinière 10, Avenue de la Libération;4400;BARCELONNETTE;04 92 81 27 15;04 92 34 55 17;;Du 16 novembre au 15 décembre inclus et 1er mai, 25 décembre et 1er janvier;Ouvert du mercredi au samedi de 14h30 à 18h hors vacances scolaires. Du 15 juin au 6 juillet et du 1er au 14 septembre du mercredi au dimanche de 14h30 à 18h, du 6 juillet au 31 août tous les jours de 10h à 12h et de 14h30 à 18h30;;01/02/2003;;PROVENCE-ALPES-CÔTE D'AZUR;ALPES DE HAUTE PROVENCE;44.3554624604,6.65679459978
Musée Municipal Méditerranéen de Cassis A.T.P.;1302201;Rue Xavier-D'Authier;13260;CASSIS;04 42 01 88 66;04 42 01 66 87;;;Ouvert d'octobre à mai du mercredi au samedi de 10h à 12h30 et de 14h30 à 17h30 et de juin à septembre du mercredi au samedi de 10h à 12h30 et de 14h à 18h;;01/02/2003;;PROVENCE-ALPES-CÔTE D'AZUR;BOUCHES DU RHONE;43.214464,5.540037
Musée Municipal d'Art et d'Histoire;9202501;2, Rue Gabriel Péri;92700;COLOMBES;01 47 86 38 85;01 47 85 00 75;;Aoüt et 1 semaine durant les vacances de Noël;Ouvert du mercredi au samedi de 14h à 18h, vendredi de 16h à 19h pour les groupes sur réservation tout au long de la semaine;;01/02/2003;;ÎLE-DE-France;HAUTS DE SEINE;48.923321,2.252039
Musée du Château;9120001;Place du Général de Gaulle;91410;DOURDAN;01 64 59 66 83;01 64 59 21 65;;1er au 14 Janvier, 25 décembre;Ouvert du mercredi au dimanche et les jours fériés de 10 h à 12 h et de 14 h à 18 h, 17h le vendredi;;01/02/2003;;ÎLE-DE-France;ESSONNE;48.529353,2.011459
Musée de la Mode;1305509;11 , Rue La Canebière;13001;MARSEILLE;04 96 17 06 00;04 96 17 06 01;;Jours fériés;Ouvert du mardi au dimanche de 11h à 18h de juin à septembre et de 10h à 17h d'octobre à mai;;01/02/2003;;PROVENCE-ALPES-CÔTE D'AZUR;BOUCHES DU RHONE;43.295914,5.376156
Musée Municipal;8412301;Hôtel de Ville;84390;SAULT;04 90 64 02 30;04 90 64 08 59;;Autres mois de l'année;Ouvert en juillet à août du lundi au samedi de 15h à 18h;;01/02/2003;;PROVENCE-ALPES-CÔTE D'AZUR;VAUCLUSE;44.029407,5.494037
Musée d'Histoire Naturelle et de Préhistoire;3018901;13 Bis, Bd Amiral Courbet;30033;NIMES;04 66 76 73 45;04 66 76 73 46;;1er janvier, 1er mai, 1 & 11 novembre, 25 décembre;Ouvert du mardi au dimanche de 10h à 18h;;06/01/2002;;OCCITANIE;GARD;
Musée Archéologique Théo Desplans;8413701;Hôtel de Ville Cours Taulignan;84110;VAISON-LA-ROMAINE;04 90 36 50 05;04 90 36 50 29;;Entre les vacances de Noël et de février;Ouvert de novembre à février de 10h à 12h et de 14h à 17h, de mars et octobre de 10h à 12h30 et de 14h à 17h30, d'avril et mai de 9h30 à 18h, de juin à septembre de 9h30 à 18h30;;01/02/2003;;PROVENCE-ALPES-CÔTE D'AZUR;VAUCLUSE;44.2444427122,5.0525358539
Musée du Colombier;3000702;Rue Jean Mayodon;30100;ALES;04 66 86 30 40;04 66 34 20 51;;2ème quinzaine de février, 1er janvier, 1er mai, jeudi de l'Ascension, 14 juillet, 1er novembre, 25 décembre;Ouvert du lundi au dimanche de septembre à juin de 14h à 18h et en continu durant les expositions estivales;;01/02/2003;;OCCITANIE;GARD;44.12932,4.080966
Musée-Bibliothèque Pierre-André Benoît;3000701;Rue de Brouzen Pôle culturel de Rochebelle;30100;ALES;04 66 86 98 69;04 66 34 20 51;;1ère quinzaine de février, 1er novembre, 25 décembre, 1er janvier, 1er mai, 14 juillet, jeudi de l'Ascension;Ouvert du lundi au dimanche de septembre à juin de 14h à 18h et de 11h à 18h lors des expositions estivales;;01/02/2003;;OCCITANIE;GARD;44.1254083661,4.08875764258
Muséum Emmanuel Liais;5012901;Parc Emmanuel Liais Accès Angle rue de l'Abbaye Rue Emmanuel Liais;50100;CHERBOURG-EN-COTENTIN;02 33 53 51 61;02 33 03 48 01;;1er janvier, 1er mai, 1er et 11 novembre, 25 décembre;Ouvert du mardi au vendredi de 10h à 12h30 et de 14h à 17h, le samedi et dimanche de 13h à 18h;;01/02/2003;;NORMANDIE;MANCHE;49.6331832109,-1.6338586934
Musée d'Archéologie et d'Histoire Locale;5917201;9, Place Wilson;59220;DENAIN;03 27 44 62 12;03 27 23 59 92;;;Ouvert du mardi au vendredi de 14h à 18h, samedi de 16h à 18h et dimanche de 10h à 12h;;01/02/2003;;HAUTS-DE-France;NORD;50.327328,3.400252
Musée des Beaux-Arts;8305001;9, Rue de la République;83300;DRAGUIGNAN;04 98 10 26 85;04 94 67 37 14;;;Ouvert du mardi au samedi de 9h à 12h et de 14h à 18h;;01/02/2003;;PROVENCE-ALPES-CÔTE D'AZUR;VAR;43.537982,6.464818
Musée Municipal;3410801;4 bis, Rue Lucien Salette;34110;FRONTIGNAN-LA-PEYRADE;04 67 18 50 05;04 67 18 50 81;;;;;01/02/2003;;OCCITANIE;HERAULT;43.446991,3.754951
Musée du Pays de Guérande et de la Porte Saint Michel;4406901;Porte Saint-Michel CS 85139;44351;GUERANDE;02 28 55 05 05;02 28 55 05 05;;Janvier à mars et de novembre à décembre;Ouvert d'avril à septembre du lundi après-midi au dimanche de 10h à 12h30 et de 14h30 à 19h, en octobre de 10h à 12h et de 14h à 18h;;01/02/2003;;PAYS DE LA LOIRE;LOIRE-ATLANTIQUE;
La Maison de l'Armateur;7635105;3, Quai de l'Ile (Quartier Saint-François);76600;LE HAVRE;02 35 19 09 85;02 35 26 76 69;;1er janvier, 1er et 8 mai, 14 juillet, 11 novembre, 25 décembre;Ouvert du 1er avril au 31 octobre du mercredi au  lundi de 10h à 12h30 et de 13h45 à 18h et du 1er novembre au 31 mars de 10h30 à 12h30 et e 13h45 à 17h30;;01/02/2003;;NORMANDIE;SEINE-MARITIME;49.4965610328,0.1402707121
